{
  "schema_version": "1.0.0",
  "ledger_entry_id": "ol-2026-09-25-0007",
  "org_id": "org_acme",
  "plant_id": "plant_ghaziabad_1",
  "decision_case_id": "dc-2026-09-25-0007",
  "psm_snapshot_id": "psm-2026-09-25T04:00:00Z",
  "condition_key": "ck:idle_load:comp2:shift-a",
  "gate_id": "evidence_tier_min",
  "gate_class": "soft",
  "gate_threshold": 2,
  "gate_value": 1,
  "block_terminal": "withhold",
  "origin": "l3_finding",
  "candidate_snapshot": {
    "preferred": "inspect_unload_valve",
    "priced_sections": ["calc.idle_air.v1"]
  },
  "ledger_hash": "sha256:dddddddddddddddddddddddddddddddddddddddddddddddddddddddddddddddd",
  "lockfile_hash": "sha256:aaaaaaaaaaaaaaaaaaaaaaaaaaaaaaaaaaaaaaaaaaaaaaaaaaaaaaaaaaaaaaaa",
  "later_outcome": {
    "kind": "none_yet"
  },
  "created_at": "2026-09-25T04:03:00Z"
}
